Refran	Significado	Uso
Cada martes tiene su domingo	Se recomienda ser optimista, pensando que las cosas malas alternan con las buenas.	En desuso
Cada par con su par	En amistad o matrimonio, recomienda relacionarse con los de naturaleza o condición similar.	En desuso
Cada santo pide por su ermita	Se utiliza para indicar que cada uno se preocupa por sus propios intereses o por sí mismo.	En desuso
Cada sendero tiene su atolladero	En cualquier empeño se presentan obstáculos y dificultades.	En desuso
Cada uno donde es nacido, y bien se está el pájaro en su nido	Recomienda no abandonar el lugar de origen.	En desuso
Cada uno en su casa es rey	Alude a la independencia que uno goza en su hogar, ya que puede tomar decisiones con total libertad o hacer su voluntad.	En desuso
Cada uno se conoce por sus obras	Se conoce y se aprecia a las personas por lo que hacen y por su manera de hacerlo.	En desuso
Cada uno ve con los ojos que Dios le ha dado	Cada cual tiene su opinión, de acuerdo con lo que la naturaleza y la experiencia le han proporcionado.	En desuso
Callen barbas y hablen cartas	Resulta gratuito hablar cuando hay documentos para probar lo que uno dice, porque más fuerza poseen los documentos que acrediten algo que el testimonio oral.	En desuso
Calumnia, que algo queda	Alude al perjuicio que causa la calumnia, pues resulta difícil demostrar la inocencia del calumniado y recuperar su buena fama.	En desuso
Camarón que se duerme se lo lleva la corriente	Critica la poca diligencia de alguien, que ha de cargar con las consecuencias, principalmente para él.	En desuso
Caminante cansado, subirá en asno, si no encuentra caballo	Quien necesita algo con urgencia deberá tomar cualquier remedio próximo, pese a no ser el mejor ni el más apetecido.	En desuso
Camino de Roma, ni mula coja ni bolsa floja	Del mismo modo que se necesitan buenos medios de locomoción y dinero para realizar un largo viaje, no se debe emprender algo arduo sin contar con los medios adecuados.	En desuso
Canta la rana, y no tiene pelo ni lana	Recomienda paciencia, conformidad y alegría para superar el desánimo, la pobreza o alguna contrariedad, como hacen algunos que sufren carencias.	En desuso
Cantar mal y porfiar	Critica al impertinente y presumido que, pese a hacer algo mal, persiste en el error.	En desuso
Cantar pensé y, por cantar, lloré	En ocasiones se ven defraudadas nuestras esperanzas, de modo que llegan penas cuando se esperan alegrías.	En desuso
Cantó el cuquillo y descubrió su nidillo	Muestra cómo las indiscreciones, en particular las indiscreciones en el hablar, perjudican a quien las comete.	En desuso
Cara de beato y uñas de gato	Alude a quien alaba o aplaude en presencia de alguien y lo vitupera en su ausencia.	En desuso
Caridad y amor, sin tambor	Aconseja hacer bien sin difundirlo, por vanagloria.	En desuso
Carne, carne cría; y peces, agua fría	Estre refrán da a entender que la carne es alimento más sustancioso que el pescado.	En desuso
Carnero, comer de caballero	Se elogia la carne de carnero.	En desuso
Casa al hijo con tu igual, y de ti no dirán mal	Recomienda buscar pareja de la misma posición social o económica y, de este modo, se evitarán las críticas.	En desuso
Casa cerrada, casa arruinada	Cuando no se habita una casa o no se vigila, se echa a perder.	En desuso
Casa convidada, pobre y denostada	Advierte contra las críticas que recibe de los convidados quien recibe amigos en casa y al cabo no puede seguirles atendiendo como a estos les gustaría por tener que atender sus obligaciones o ha pasado ya un tiempo prudencial.	En desuso
Casa en cantón y viña en rincón	Da a entender la conveniencia de tener casa con vistas a dos calles porque tendrá mejor luz y la viña resguardada de las inclemencias del tiempo y de los viandantes. También señala que las propiedades tienen más valor cuanto mejor situadas estén.	En desuso
Casa hecha, sepultura abierta	Se dice con motivo del fallecimiento de alguien que acababa de construir su casa. A veces, los sacrificios, los esfuerzos y la ansiedad provocados podrían ser un factor desencadenante del fallecimiento de alguien con algún problema de salud.	En desuso
Casa mía, casa mía, por pequeña que tú seas, me pareces una abadía	A cada uno le agrada estar en su casa, donde se encuentra a su aire, aunque pueda haber otras más amplias o lujosas.	En desuso
Casarás y amansarás	Cuando uno se casa suele dejar de hacer cosas propias de una persona sin la responsabilidad de una familia.	En desuso
Casa sin mujer y barco sin timón, lo mismo son	Una y otro gobiernan la casa y la embarcación, respectivamente. Denota la necesidad de que haya una mujer para el buen gobierno de una casa. En general, alude a la necesidad de que haya un jefe.	En desuso
Cerezas y males traen detrás otros tales	Se emplea cuando a una misma persona le suceden dos o más desgracias casi seguidas.	En desuso
Coces de yegua, amor es para el rocín	Los castigos dados por amor no causan daño sino todo lo contrario. Se puede aplicar también a la poca importancia que se da a las molestias que conlleva la convivencia entre dos personas, cuando se quieren de verdad.	En desuso
Comer hasta enfermar y ayunar hasta sanar	Hay quienes no saben poner freno a su apetito y enferman, hasta el extremo que sólo recuperan la salud mediante la dieta.	En desuso
Comida acabada, amistad terminada	Recrimina a quienes se alejan del amigo, una vez que ya no se obtiene provecho de él.	En desuso
Comida fría y bebida caliente, no hacen buen vientre	Recomienda abstenerse de tomar alimentos fríos y bebidas calientes con el objeto de evitar molestias intestinales.	En desuso
Como canta el abad responde el monacillo	Por lo general, los súbditos se ajustan al dictamen o manera de actuar de los superiores. Se aplica también al discípulo que procede en función de las enseñanzas recibidas de su maestro. Asimismo, se debe ser cortés con todos y no dar motivo para que le falten el respeto.	En desuso
Como es el pan será la sopa	Con buenos condimentos se obtiene una buena comida. Del mismo modo, quien posee buena condición hará buenas obras. En sentido general, se aplica a la relación existente entre la calidad de algo y su materia prima.	En desuso
Como se vive, se muere	De la vida que uno lleve depende el fin que tenga. Las costumbres determinan en gran medida el tipo de vida y el probable final de cada uno.	En desuso
Compañía de dos, compañía de Dios	Da a entender que, en un asunto o negocio, se avienen mejor dos que muchas personas. También es una manera de hablar del matrimonio.	En desuso
Compartir es vivir	Ensalza el hecho de ayudar a los demás con lo que uno posee y disfrutando en común de lo que uno tiene.	En desuso
Compón el sapillo, parecerá bonillo	La fealdad puede quedar encubierta con la ropa y el arreglo personal. El atractivo físico se puede mejorar con ayuda de elementos accidentales, como la ropa o los adornos.	En desuso
Compra lo que no has menester y venderás lo que no podrías excusar	Recrimina los gastos superfluos y aconseja limitarse a comprar lo que se necesita realmente.	En desuso
Compuesta, no hay mujer fea	Nadie debe apenarse si no tiene atractivo natural, puesto que puede buscar el modo de mejorar su imagen con ayuda de los vestidos y el arreglo personal. Se dice también para reducir la admiración que puede suscitar una mujer gracias al maquillaje, la ropa y otros detalles.	En desuso
Con ajena mano, sacar la culebra del horado	Censura a quien se sirve de la ayuda de los demás para empresas peligrosas.	En desuso
Con buen pan y buen vino, no te faltarán amigos	Las invitaciones a comer bien granjean amigos.	En desuso
Con buen traje se entra y encubre el ruin linaje	Ir bien vestido abre puertas, pero también puede encubrir al que lleva mala intención.	En desuso
Conforme ven el traje tratan al paje	El trato y atención a las personas puede verse influido por su apariencia externa, aunque hay decepciones y engaños. Aconseja cuidar la compostura y la manera de vestir para favorecer una acogida favorable por parte de la sociedad.	En desuso
Con gente bulliciosa, poca cosa	Recomienda alejarse de las personas demasiado parlanchinas.	En desuso
Con hermosura sola no se pone la olla	La elección de esposa no conviene basarse únicamente en el atractivo, sino en las cualidades de esposa y ama de casa.	En desuso
Con la ayuda del vecino, mató mi padre un cochino	En ocasiones resulta necesario contar con los demás para la realización de acciones concretas.	En desuso
Con ladrones y gatos, poco trato	Tanto el ladrón como el gato, están considerados dos peligros para los bienes e incluso para la propia vida. En sentido general, se recomienda evitar aquello que pueda perjudicarnos.	En desuso
Con las glorias se olvidan las memorias	Quien adquiere una alta posición social o llega a ocupar un puesto importante, suele olvidarse de los amigos y de los favores recibidos.	En desuso
Con lo mío me ayude Dios	Es mejor atenerse a lo propio y no depender de otros. Emplean esta frase quienes se conforman con lo que tienen.	En desuso
Con lo que sana el hígado, enferma el bazo	Del mismo modo que lo que es bueno para un órgano no lo es para otro, lo que aprovecha a unas cosas o a algunas personas perjudica a otras, por lo que no todas las cosas convienen a todos.	En desuso
Con mi duro cuento yo; con mi amigo quizás no	Esta reflexión la haría quien echa sus cálculos y entiende que es preferible que se limite a lo que tiene sin esperar dinero de otros.	En desuso
Con necesidad, no hay ley	Cuando falta lo esencial o se presenta una emergencia, puede ocurrir que se excuse lo que no sería aceptable, se cometa alguna infracción o incluso un delito por atender las necesidades básicas.	En desuso
Con paciencia todo se logra	Se emplea para recomendar no impacientarse, porque muchas cosas se obtienen al cabo del tiempo y de muchos esfuerzos.	En desuso
Consejo no pedido, consejo mal recibido	Alude a la situación en la que no agrada recibir consejos por no haber sido solicitados. Hay personas que dan consejos por el bien de uno sin esperar a que se lo pidan o simplemente porque están acostumbradas a dar su opinión, e incluso a imponerla.	En desuso
Corazón alegre, hombre sano	La alegría y el buen humor son un excelente tónico para la vida.	En desuso
Cortesía de boca, mucho vale y poco cuesta	Elogia la utilidad de los buenos modales.	En desuso
Cosa fea, ni se haga ni se aprenda	No es aconsejable hacer nada reprensible.	En desuso
Cosa prometida, es medio debida	Advierte de la obligación que se contrae al hacer promesas.	En desuso
Costumbres y dineros hacen a los hijos caballeros	Se gana la atención y el aprecio de los demás -en definitiva, una mejor posición social- con riquezas y buenos modales.	En desuso
Cual el año, tal el jarro	Según haya sido meteorológicamente el año, así será la vendimia que se recoja y, por consiguiente, la calidad y cantidad del vino. Conforme sea la cosecha, abundante o escasa, así será el tamaño del jarro con el que se dé de beber. De modo general, señala la necesidad de que los gastos no superen los medios para cubrirlos.	En desuso
Cual el cuervo, tal el huevo	Por lo general, los hijos son como los padres, a quienes imitan en su modo de pensar y proceder.	En desuso
Cual el rey, tal la grey	Denota la gran influencia que ejerce en las costumbres de un pueblo o de una comunidad el comportamiento de quien los gobierna. Por eso, recomienda a los gobernantes actuar con honestidad y a los súbditos elegir bien a sus gobernantes.	En desuso
Cual el tiempo, tal el tiento	Es conveniente adaptarse a los cambios en la sociedad y en la vida.	En desuso
Cual es la madre, así las hijas salen	Las hijas siguen en gran medida el modo de proceder de su madre, hasta el punto a veces de convertirse en su reflejo.	En desuso
Cuando atruena en marzo, apareja las cubas y el mazo	En el mes de marzo, la lluvia que anuncian los truenos puede ser muy beneficiosa para el campo, y consiguientemente para obtener una buena cosecha.	En desuso
Cuando Dios amanece, para todos amanece	Este refrán tiene un doble sentido: por un lado, indica que debe compartirse con los demás los bienes que uno posee; por otro lado, señala que son gratuitos los bienes fundamentales de la vida.	En desuso
Cuando el diablo no tiene qué hacer, con el rabo mata moscas	Critica a quien pierde el tiempo o lo derrocha en cosas inútiles.	En desuso
Cuando el diablo reza, engañar te quiere	Recrimina a los hipócritas y, por lo general, a quienes ocultan su dañina intención con buenas apariencias.	En desuso
Cuando falta la piel del león, es preciso tomar la de la zorra	A falta de algo mejor, hay que conformarse con lo que está a nuestro alcance.	En desuso
Cuando fueres por camino, no digas mal de tu enemigo	Recomienda la precaución en el hablar de los demás cuando se va por lugares públicos donde hay personas desconocidas.	En desuso
Cuando la cabeza duele, todo el cuerpo duele	El cuerpo es un todo que acusa cualquier malestar. De igual modo, lo que aflige al miembro de una familia o de un grupo, repercute en el resto de sus miembros. Con frecuencia se aplicaba a las relaciones entre el rey y sus súbditos.	En desuso
Cuando la pobreza entra por la puerta, el amor sale por la finestra	Cuando el amor no es firme, las dificultades y, más aún, la pobreza acaban con él.	En desuso
Cuando la zorra anda a caza de grillos, mal para ella y peor para sus hijos	Denota la gran necesidad y pobreza que tiene quien hace lo que no corresponde a su estado, quien se emplea en cosas de escasísima utilidad.	En desuso
Cuando la zorra predica no están seguros los pollos	Hemos de prevenirnos ante el comportamiento inusual de una persona, porque muy probablemente obedece a una intención velada que nos afectará negativamente.	En desuso
Cuando un lobo come a otro, no hay qué comer en el soto	Hay que huir de sitios agradables, pero en los que existen riesgos.	En desuso
Cuanta más grandeza, más llaneza	La gente de verdadera calidad suele ser de carácter sencillo y se descubre en su comportamiento, en su trato dulce, exento de ceremonias y rigidez.	En desuso
Cuanto más amigos, más claridad	La franqueza en las opiniones y la exactitud en las cuentas son medios para mantener la amistad.	En desuso
Cuanto más viejo, más pellejo	Ciertas inclinaciones e instintos no se reducen sino que se acrecientan con el paso de los años.	En desuso
Cuantos hombres, tantos pareceres	Resulta difícil que haya coindicencia de opinión entre varias personas y, aun coincidiendo bastante, lo habitual es que haya distintos pareceres.	En desuso
Cuenta tu pena a quien sabe de ella	La persona que ha sufrido puede comprender mejor la situación, así como dar consuelo y buenos consejos.	En desuso
Cuenta y razón, conservan amistad	Muestra que debe haber seriedad en las cuentas incluso entre grandes amigos.	En desuso
Cuerpo descansado dinero vale	Es una manera de justificarse por no trabajar. Si no se va a conseguir gran cosa trabajando más, se lo toma uno con calma. Hay quienes prefieren no trabajar demasiado pues, con librarse de las fatigas, se consideran también pagados o recompensados. Podría emplearlo  también como réplica quien ha hecho un  trabajo para otro, al que cuando llega la hora de pagar le parece mucho.	En desuso
Cuida bien lo que haces, no te fíes de rapaces	Advierte que uno no debe encomendarse a jóvenes inexpertos cuando se trata de asuntos o negocios de importancia.	En desuso
Cuida de tus duelos y deja los ajenos	Cada cual debe estar a lo suyo y no apenarse en exceso por lo que no nos concierne.	En desuso
Cuidados ajenos mataron al asno	Critica a las personas entrometidas y advierte de las molestias que causa tratar de ayudar a otros, cuyos problemas no nos afectan directamente.	En desuso
Culo de mal asiento, no acaba cosa ninguna y empieza ciento	Se refiere a quienes comienzan varias cosas pero no se centran y todo lo dejan a medias. Quienes no son constantes no llegan a terminar trabajo alguno.	En desuso
Cura más la dieta que la lanceta	Una buena dieta ayuda más a conservar o restablecer la salud que la medicina.	En desuso
Da Dios almendras al que no tiene muelas	Se emplea con ironía para aludir a quien no puede aprovechar las riquezas o los beneficios que recibe.	En desuso
Dádivas quebrantan peñas	Lo que parece imposible de vencer suele ceder con obsequios.	En desuso
Dame gordura, darte he hermosura	Estima que la gordura realza la belleza física, al tiempo que pondera la belleza sin excesiva delgadez.	En desuso
Dame y te daré	Hay que ser agradecidos y corresponder a la ayuda y a los favores recibidos. Quien dice este refrán señala que está dispuesto a aceptar y hacer concesiones, a recibir ayuda y a ayudar.	En desuso
Dando gracias por agravios negocian los hombres sabios	Encarece el modo en que actúan las personas sabias, que no se muestran excesivamente agraviadas antes las injurias sino aparentemente comprensivas y con generosidad.	En desuso
Dando la gotera hace señal la piedra	Da a entender que las mayores dificultades se vencen con tenacidad y constancia.	En desuso
Dar coces contra el aguijón es poca discreción	Alude a quien porfía contra la razón o un poder mayor, a quien trata de resistir a una fuerza a la que no se puede vencer. No hay que empeñarse en hacer frente a una fuerza superior, pues lo único que se consigue es salir perjudicado, como le sucede a la bestia que pretende dar patadas a la aijada, con lo que se pincha más pronta y profundamente.	En desuso
Date prisa despacio, y llegarás a palacio	No es bueno el apresuramiento, pues con frecuencia malogra lo que pretendemos.	En desuso
Da y ten, y harás bien	Previene contra la prodigalidad. El que da sin medida ni cabeza puede verse en necesidad, por lo que se debe ser generoso con medida.	En desuso
De alegría también se llora	Paradójicamente, el llanto puede deberse a satisfacción y contento.	En desuso
De amigo a amigo, sangre en el ojo	La sangre, la chinche, el agraz... representan las ingratitudes que a veces llegan de quienes se llaman amigos. Alude a quienes hieren en lo más delicado a las personas que le han otorgado su confianza. Por eso, se recomienda no confiar demasiado en los que se venden por amigos.	En desuso
De buena casa, buena brasa	Señala que, de la casa rica, son buenos hasta los desperdicios. En sentido general, se aplica también a personas.	En desuso
De buen vino, buen vinagre	Cuando se emplean elementos de calidad, el resultado es satisfactorio. Se aplica también cuando entre la ascendencia y la descendencia existe una relación de calidad.	En desuso
Decir y hacer no comen a una mesa	No hay que confiar alegremente en lo que dicen o prometen las personas, y más sin conocerlas bien. Esta paremia manifiesta también lo difícil que resulta medir las obras con las palabras.	En desuso
De dinero y calidad, la mitad de la mitad	Con frecuencia se exagera la riqueza o el linaje de alguien.	En desuso
De enamorado a loco va muy poco	En ocasiones el amor puede convertirse en una obsesión y rozar la locura.	En desuso
De herrero a herrero, no pasa dinero	Quienes son de un mismo oficio no suelen cobrarse entre sí, pues, por lo general, hay buena correspondencia entre las personas de un mismo gremio.	En desuso
De la abundancia del corazón habla la lengua	Se refiere a quien habla conforme a sus inclinaciones o afectos. La palabra, por tanto, revela sus sentimientos o intenciones.	En desuso
De la discusión nace la luz	En el intercambio de pareceres puede surgir el medio de resolver un problema. Por eso, se aconseja cambiar impresiones para llegar a acuerdos y aclarar cuestiones.	En desuso
De la mano a la boca, se pierde la sopa	Señala que la más fundada esperanza de lograr algo pronto puede quedar destruida en un instante, por lo que algo no es seguro hasta que no se tiene.	En desuso
De la puerta cerrada el diablo se vuelve	Hay que evitar las ocasiones peligrosas y no dar facilidades a quien nos puede hacer mal.	En desuso
Del árbol caído, todos hacen leña	Cuando alguien pierde su autoridad, sufre alguna contrariedad o queda sin protección, puede suceder que los demás traten de sacar provecho de esta circunstancia.	En desuso
De la risa al duelo, un pelo	Los cambios en la vida se producen de un momento a otro, pudiendo pasarse de una situación a otra menos favorable casi sin darnos cuenta.	En desuso
Del bien al mal no hay un canto de real	Alude a la inestabilidad de la fortuna que puede afectar a los bienes en sentido negativo y provocar daños cuando menos se espera.	En desuso
Del cuero salen las correas	La evidencia de que es necesario tener la materia prima para confeccionar artículos de dicho material sirve para afirmar que, si se tiene lo principal, todo está resuelto, pues resulta más fácil conseguir lo secundario o accesorio.	En desuso
Del mar, el mero; de la tierra, el cordero	Afirma que la carne de estos animales resulta más apetitosa que la de los demás.	En desuso
De lo contado come el lobo	Critica el exceso de celo. Puede atraer la malevolencia el hecho de comprobar demasiadas veces los bienes, las cosas consideradas valiosas. Denota también que suele perderse lo que más se cuida, por mucho que se haga para resguardarlo.	En desuso
De lo que no veas, ni la mitad te creas	Recomienda ser escéptico con lo que no se conoce directamente. Sin pruebas resulta difícil aceptar la existencia de algo o la veracidad de una argumentación. Por eso, se dice también el refrán Más vale ver que creer (Sbarbi,«ver»), para indicar que las mejores argumentaciones son las pruebas de lo que se afirma.	En desuso
De los amores y las cañas, las entradas	Los principios resultan más entusiastas y ardorosos, tanto en la relación amorosa como en el antiguo juego de cañas, porque las energías van menguando y puede suceder lo que anuncia el refrán: Los amores entran riendo y salen llorando (Correas1627 D124). Este refrán contiene una advertencia escéptica acerca de que el amor empieza a perder atractivo con el conocimiento y la convivencia.	En desuso
De los enemigos, los menos	Cuantos menos rivales se tenga, más fácilmente resultará vencerlos y se vivirá más seguro. Se emplea cuando se pretende deshacerse de quien causa daño o perjuicio.	En desuso
De los escarmentados nacen los avisados	Quien ha padecido algún daño, tiene miedo de que le vuelva a suceder algo parecido y huye de cualquier situación similar.	En desuso
Del que jura, teme la impostura	Previene contra quien enfatiza mucho con juramentos afirmaciones o promesas, que pueden desencadenar un ataque inesperado.	En desuso
De mal cuervo, mal huevo	Con frecuencia los hijos son comos sus padres, ya sea en las virtudes ya sea en los defectos.	En desuso
De mí te reirás, pero de mi dinero, no	Uno puede burlarse de alguien, pero no de su riqueza. Simula un comentario para sí mismo en el que da a entender que no se le engaña fácilmente en cuestiones económicas.	En desuso
De músico, poeta y loco, todos tenemos un poco	Nadie actúa siempre racionalmente, puesto que en su conducta a veces irrumpen sin control las fuerzas típicamente ilógicas del arte (música), el amor (poesía) o la locura.	En desuso
De padre santo, hijo diablo	No siempre los hijos heredan las virtudes de sus padres ni aprovechan su buena crianza, si son de mal natural.	En desuso
De padres gatos, hijos michinos	Es lógico que los hijos se parezcan a los padres.	En desuso
De paja o heno, el vientre lleno	A falta de lo que agrada o apetece, cualquier cosa puede ser buena, para saciar el hambre, como la paja o el heno, considerados alimentos vegetales para los animales de poco valor nutritivo.	En desuso
De pequeña centella grande hoguera	En ocasiones, hechos insignificantes pueden provocar efectos de gran importancia, por lo que no se debe despreciar lo pequeño, aunque parezca que tiene poca importancia.	En desuso
De potro sarnoso, caballo hermoso	Algo de fea apariencia puede llegar a hacerse bello.	En desuso
De quien mucho miente, huye la gente	El mentiroso provoca enfado y desconfianza	En desuso
De rabo de puerco, nunca buen virote	Del mismo modo que del rabo retorcido del cerdo no puede salir una saeta derecha, de personas de vil condición no cabe esperar acciones ni obras nobles.	En desuso
Desdichas y caminos hacen amigos	Los viajes con los amigos y compartir situaciones difíciles contribuyen a ejercitar la paciencia y la tolerancia mutuas. En un sentido más amplio, esta paremia alude a la convivencia, como vía para conocer mejor a las personas y para comprobar si en verdad están dispuestos a prestar ayuda.	En desuso
Desgracia compartida, menos sentida	Cuando tenemos una preocupación o una pena, podemos aliviarlas contándosela a otra persona, de quien puede venir consuelo, comprensión y, tal vez, ayuda efectiva.	En desuso
Desnudo nací, desnudo me hallo: ni pierdo ni gano	Quien no tiene ambición, se conforma con facilidad, incluso si pierde. Se emplea para expresar resignación ante el infortunio.	En desuso
Después de beber, cada uno dice su parecer	Resulta difícil guardar un secreto tras haber abusado de la bebida.	En desuso
Después de los años mil, vuelven las aguas a su carril	Al cabo de un tiempo, más o menos largo, las situaciones se enderezan, o al menos se amortigua su efecto.	En desuso
Después de pera comer, bebe vino si no quieres fenecer	Alude a la creencia popular de que el agua sienta mal si se bebe después de haber comido fruta.	En desuso
Después de vendimias, cuévanos	Alude a lo que se hace tras pasar la ocasión, cuando ya es tarde.	En desuso
De tal cabeza, tal sentencia	Las palabras de una persona descubren lo que hay en su cabeza. Se aplica en sentido irónico o burlesco cuando alguien que no destaca por su sensatez da una opinión disparatada.	En desuso
