Refran	Significado	Uso
Lo que no se comienza, nunca se acaba	Exhorta a ser firmes en el obrar. La realización de cualquier acto implica ponerse manos a la obra, venciendo la pereza que a veces acomete a las personas.	En desuso
Lo que otro suda, a mí poco me dura	Se dice para expresar la convicción de que la ropa usada dura poco, aunque sea regalada. En sentido idiomático se aplica cuando se suele gastar con prodigalidad lo que se adquiere por donación o por herencia, por lo que se recomienda aplicación en el trabajo con el objeto de conservar bien los bienes.	En desuso
Lo que poco cuesta, poco se aprecia	No se suele valorar en su justa medida lo que se ha adquirido a muy buen precio o sin apenas esfuerzo.	En desuso
Lo que uno desecha, a otro aprovecha	Se aplica cuando algo resulta beneficioso para algunos y para otros no.	En desuso
Los hombres ganan la hacienda y las mujeres la conservan	Elogia el papel de la mujer en la buena administración de las propiedades.	En desuso
Los huéspedes mucho gusto dan, pero cuando se van	Alude a la facilidad con uno se cansa de las visitas y a la alegría que uno manifiesta cuando se marchan.	En desuso
Los toros se ven mejor desde la barrera	Resulta fácil juzgar algo desde un sitio donde no hay peligro alguno.	En desuso
Luna con cerco, lluvia y viento	Pronóstico meteorológico para anunciar la lluvia y el viento tomando como referencia la luna.	En desuso
Madrastra, madre áspera, ni de cera ni de pasta	Uno de los miembros de la familia menos apreciados y amados es la madrastra, porque se considera que no quieren a sus hijastros.	En desuso
Malas son de guardar las viñas en septiembre y las doncellas siempre	En sentido recto, aconseja estar vigilantes para no perder la cosecha ante la recolección de la uva y para que no pierda la virginidad la doncella que está a nuestro cuidado. En sentido general, recomienda estar vigilantes cuando estamos a punto de recoger el beneficio de un asunto.	En desuso
Mal me quieren mis comadres, porque les digo las verdades	Advierte que con frecuencia se puede despertar la animadversión hacia quien se muestra franco con uno.	En desuso
Mal para quien calla y peor para quien habla	Hay situaciones en las que resulta difícil saber lo que es más conveniente, callar o hablar.	En desuso
Mandar no quiere par	Si son muchos los que gobiernan, es normal que haya discordancia de pareceres.	En desuso
Manos duchas comen truchas	Con la imagen de la pesca de truchas empleando para ello sólo las manos, se alude a la habilidad o maestría de alguien.	En desuso
Marido celoso no tiene reposo	Quien sufre de celos no tiene tranquilidad.	En desuso
Más ablanda el dinero que palabras de caballero	Alude al poder del dinero para alcanzar las cosas.	En desuso
Más caga un buey que cien golondrinos	Quien es valeroso de una sola vez hace más que quien no lo es en mucho tiempo y con mucha diligencia. Se utiliza para ensalzar la facultad de alguien para hacer algo frente a otro más débil.	En desuso
Más corre el cojo que el sano	Quien no posee tara física alguna tiene más posibilidades de triunfar. En sentido general, llega mucho más lejos quien carece de obstáculos, quien no ha de luchar continuamente con la adversidad.	En desuso
Más daño hacen amigos necios que enemigos descubiertos	Las personas insensatas, si son amigos nuestros, resultan muy peligrosas porque pueden desvelar secretos nuestros sin darse cuenta del daño que nos pueden hacer.	En desuso
Más discurre un hambriento que cien letrados	El estar en un apuro hace aumentar el ingenio.	En desuso
Más hace el lobo callando que el perro ladrando	La comparación entre dos animales (uno salvaje y otro doméstico) sirve para marcar la diferencia de autoridad y poder entre dos personas, una de ellas con un carácter mucho más fuerte. Con su sola presencia, impone su autoridad.	En desuso
Más moscas se cogen con miel que con hiel	Para atraer la voluntad de alguien, lo mejor es la dulzura.	En desuso
Más quiero libertad con pobreza que prisión con riqueza	Exorta a ser libre, aunque ello signifique carecer de bienes.	En desuso
Más sabe el loco en su casa que el cuerdo en la ajena	El dueño de un negocio sabe más de él, por poco que entienda, que otra persona que lo juzga de lejos y sin conocimiento alguno. Da a entender la importancia de la experiencia. Con este refrán se excusa a veces el comportamiento de alguien que resulta incomprensible, pero que tiene su fundamento aunque no es conocido porque no es discreto hacerlo público.	En desuso
Más se ha de estimar un diente que un diamante	Del mismo modo que es preferible el diente natural al postizo, resulta mucho mejor lo natural y necesario para la vida que lo accesorio.	En desuso
Más vale agua del cielo que todo el riego	Alude a lo beneficiosa que resulta la lluvia para la agricultura.	En desuso
Más vale amigos en la plaza, que dineros en el arca	Es preferible el valor de la amistad al del dinero.	En desuso
Más vale buena esperanza que ruin posesión	Da a entender que es preferible soñar con lo que se desea a adquirirlo con malas artes o por la fuerza.	En desuso
Más vale buena fama que dorada cama	Es preferible el valor moral reconocido que la riqueza.	En desuso
Más vale buen callar que mal hablar	Este refrán se emplea en sentido recto. Elogia la discreción en el hablar.	En desuso
Más vale buen vecino que pariente ni primo	Se ensalza la vencidad frente al parentesco porque, en las situaciones difíciles, se recurre con frecuencia a la persona más cercana, un vecino, por lo general.	En desuso
Más vale burro sano que sabio enfermo	Se ensalza la salud frente a la enfermedad, aunque ello signifique que va unido a la necedad.	En desuso
Más vale gastar en pan que en botica	Recomienda llevar una dieta sana para evitar caer enfermos.	En desuso
Más vale la práctica que la gramática	Se aprende un oficio ejerciéndolo. Se da más valor al conocimiento práctico que al teórico.	En desuso
Más vale morir con honra que vivir con deshonra	Exhorta a mantener en todo momento una reputación intachable, aunque suponga realizar grandes sacrificios.	En desuso
Más valen dos bocados de vaca que siete de patata	Es preferible la calidad a la cantidad.	En desuso
Más vale onza de sangre que libra de amistad	Los vínculos familiares prevalecen sobre los de la amistad.	En desuso
Más vale perder que más perder	Da a entender que es mejor privarse de algo a verse continuamente privado de cosas.	En desuso
Más vale perderse el hombre que, si es bueno, perder el nombre	Es preferibe preservar la buena reputación que vivir sin ella.	En desuso
Más vale perro vivo que león muerto	Es preferible estar vivo sin ningún tipo de autoridad a estar muerto.	En desuso
Más vale preguntar viejo, que morir necio	El aprendizaje no tiene edad, pues a cualquier edad se aprende algo nuevo.	En desuso
Más vale quedar con gana que caer en la cama	Recomienda ser moderado en la comida para no enfermar por exceso.	En desuso
Más vale que digan de aquí huyó que aquí murió	Recriminia al cobarde y al ruin que no se atreve a comparecer y prefiere que su reputación resulte seriamente dañada.	En desuso
Más vale saber que haber	Se debe preferir la ciencia a la riqueza.	En desuso
Más vale ser amo de cabaña que mozo de campaña	Resulta preferible ser jefe de un espacio pequeño a no serlo en un espacio mucho mayor.	En desuso
Más vale ser arriero que borrico	Es preferible ser el jefe que el subordinado.	En desuso
Más vale ser envidiado que compadecido	Es preferible despertar la envidia de los demás por tener bienes o cualidades a suscitar compasión por carecer de ellos.	En desuso
Más vale soltero andar que mal casar	Recomienda preferir la soltería para evitar un matrimonio desgraciado.	En desuso
Más vale sudar que estornudar	Recomienda abrigarse o alejarse de las corrientes para evitar los resfriados.	En desuso
Más vale tuerto que ciego	Es preferible carecer de una parte de algo a vernos privados de todo, pues la privación, cuanto menor sea, menos perjudicial resultará.	En desuso
Más vale un buen amigo que un ruin pariente	En ocasiones, vale más una buena amistad que la familia, en especial si la relación resulta dañina.	En desuso
Mayo frío, mucho trigo	Este refrán señala la cosecha que habrá en función del tiempo que haga en mayo.	En desuso
Médico, cúrate a ti mismo	Se dice a quienes se ocupan de la salud humana para que vigilen también su estado de salud. En general, recomienda verse tal como uno es, con sus virtudes y defectos.	En desuso
Mejor dar que recibir	Se aplica a situaciones muy distintas, ya sea cuando alguien golpea físicamente a otro, ya sea cuando alguien ayuda a otro sin pedir nada a cambio, ya sea cuando alguien se encuentra en mejor situación que quien ha de rogar para que le auxilien.	En desuso
Mejor es lamiendo que mordiendo	Con amabilidad y adulación se obtienen más cosas que por la fuerza.	En desuso
Mejor es pan duro que ninguno	No conviene despreciar algo necesario, por muy modesto que sea.	En desuso
Mejor se enciende un horno viejo que (uno) nuevo	Se refiere al buen funcionamiento de los objetos gracias al uso.	En desuso
Menea la cola el can, no por ti sino por el pan	Por lo general, los elogios y regalos se hacen por interés, más que por amor o afecto.	En desuso
Meter aguja y sacar reja	Se dice cuando se da poco con la pretensión de obtener mucho beneficio.	En desuso
Mientras dura, vida y dulzura	Se refiere a la persona que disfruta del placer presente, sin preocuparse por el futuro.	En desuso
Mientras el necio piensa, hace el sabio la hacienda	El desenvuelto adelanta al que se retrasa por exceso de reflexión. Advierte que pensar mucho antes de decidirse no es siempre recomendable.	En desuso
Mientras en mi casa estoy, rey me soy	Cada uno, incluso el más humilde, manda en su casa.	En desuso
Mientras se gana algo no se pierde nada	Expresa la conformidad ante una pequeña ganancia, si no se consigue más.	En desuso
Mi marido es tamborilero, Dios me lo dio y así me lo quiero	Conviene estar contento con su suerte.	En desuso
Moneda falsa, de noche pasa	Resulta más fácil el engaño si se lleva a cabo con luz escasa.	En desuso
Mucho sabe la zorra, pero más el que la toma	Nadie puede confiarse en su sagacidad, porque siempre hay alguien que lo supera.	En desuso
Muchos ajos en un mortero, mal los maja el majadero	Resulta sumamente difícil para una única persona manejar a la vez muchos negocios.	En desuso
Muda el lobo los dientes, mas no las mientes	Aunque uno procure disimular su naturaleza, siempre sale a la luz, ya sea por las obras o por las palabras. Se aplica también a los malvados cuyo genio no cambia con el paso de los años.	En desuso
Muera Marta, muera harta	Critica a quienes se dedican a hacer su gusto, aunque esto les pueda ocasionar un gran daño.	En desuso
Muerta es la abeja, que daba la miel y la cera	Ya no está o ya ha muerto quien ayudaba y resolvía los problemas; por ejemplo, la madre.	En desuso
Muerte de suegra, dolor de codo, que duele mucho y dura poco	Denota la brevedad del duelo que se siente por lo general hacia la suegra. El refranero refleja el poco afecto que se profesa a la suegra.	En desuso
Mujer hermosa, viña e higueral, muy malas son de guardar	Alude al cuidado y vigilancia que se debe tener con los bienes y con la esposa, pues siempre puede haber desalmados que pretendan robar los bienes o aprovecharse de la esposa de otro.	En desuso
Mujer muerta, casa deshecha	La experiencia demuestra que si fallece la esposa, la madre o la mujer que se ocupa del gobierno de una casa, ésta se descompone y decae al faltar quien se ocupe de ella y sepa llevar con buen criterio y con amor la marcha de un hogar.	En desuso
Mujer, viento, tiempo y fortuna, presto se muda	Este refrán, de evidente sentido misógino, alude a la inestabilidad que puede producirse en la meteorología, la fortuna, al tiempo que equipara esta inestabilidad con el carácter de la mujer.	En desuso
Mundo redondo, quien no sabe nadar, vase al fondo	Advierte que para vivir y sobrevivirhay que recurrir no sólo a la inteligencia sino también a la picardía, a la astucia.	En desuso
Nadie da lo que no tiene	Da a entender que no se puede entregar lo que no se posee, ni se puede exigir de nadie que dé más de lo que puede.	En desuso
Nadie se alabe hasta que acabe	Recomienda estar seguros de haber finalizado bien algo antes de regocijarnos por algo.	En desuso
Necios y porfiados hacen ricos a los letrados	Denota que muchos pleitos se siguen no por justicia sino por tenacidad y, con frecuencia se llevan con poca razón.	En desuso
Ni a rico debas ni a pobre prometas	No conviene comprometerse con una gran deuda ni ser pródigo con quienes no cesan de pedir aduciendo necesidad.	En desuso
Ni boda sin canto ni mortuorio sin llanto	Advierte que todo tiene su parte negativa y su parte positiva, por lo que no se puede alcanzar la felicidad completa.	En desuso
Ni en la cama ni en la mesa es útil la vergüenza	Recomienda ser valeroso y alejar lo más lejos posible la vergüenza, con el objeto de no ser un dormido, pero sin mostrar exceso de desenvoltura, que al cabo enfada y se critica.	En desuso
Ni espero ni creo más de lo que veo	Expresa desconfianza de las promesas que hacen los humanos.	En desuso
Ni fía ni porfía, ni entres en cofradía	Recomienda no prestar dinero o algo de valor, no insistir ni obligarse a las normas de un grupo, ya que de todo ello se derivan situaciones desagradables.	En desuso
Ni firmes carta que no leas ni bebas agua que no veas	Recomienda ser prudente en todo momento y, de modo muy especial, antes de firmar un escrito o de tomar alguna bebida de origen incierto.	En desuso
Ni mesa sin pan, ni ejército sin capitán	Del mismo modo que se considera necesario el pan, resulta imprescindible que una colectividad esté dirigida por alguien. En general, recomienda no prescindir de lo principal.	En desuso
Ni moza fea ni vieja hermosa	La juventud, pese a ser pasajera, siempre tiene su atractivo. En cambio, la vejez carece de atractivo.	En desuso
Ni olla sin tocino ni sermón sin agustino	Advierte que el tocino da buen sabor a un cocido, del mismo modo que un buen predicador debe valerse de la doctrina de San Agustín, si quiere hablar con fundamento teológico. Se emplea para explicar que algo no es perfecto porque falta lo esencial o para criticar a quien siempre habla de lo mismo. Se puede utilizar también con un sentido irónico, para motejar a quien siempre habla de lo mismo.	En desuso
Ni sábado sin sol ni mocita sin amor	Alude a lo que sucede de forma regular y frecuente en períodos determinados, como el amor en la juventud, el rostro enrojecido en la vejez, el padecimiento de algún mal en la vejez, el buen tiempo en el sábado, el día destinado al descanso.	En desuso
Ni se muere padre ni cenamos	Con esta frase se señala que no se produce la resolución de un asunto del que depende la de otro, por lo que ni se hace una cosa ni otra.	En desuso
Ni tomes cohecho ni pierdas derecho	Para conseguir algo no hay que tener tratos pocos limpios, pero tampoco se debe renunciar a los derechos legítimos. Sin perder lo que le pertenece, debe lograr algo siempre que le corresponda.	En desuso
Ni tras pared ni tras seto, digas tu secreto	Recomienda discreción en el hablar en todo momento, incluso si se está seguro de que nadie le oye.	En desuso
Ni virtud en la juventud ni en la vejez salud	Conviene ser realistas y no pedir cosas imposibles cuando no es el momento adecuado.	En desuso
Ni yerba en el trigo ni sospecha en el amigo	Aconseja evitar tanto la mala hierba en el trigo como culaquier duda sobre una amistad.	En desuso
No cojas la pera hasta que esté madura	Aconseja esperar el tiempo que haga falta para que llegue el momento oportuno.	En desuso
No con quien naces sino con quien paces	En lo que se refiere a las costumbres, hacen más las compañías que el linaje y la crianza.	En desuso
No es menos saber guardar que saber ganar	Anima a ahorrar parte de lo que se ha conseguido con esfuerzo.	En desuso
No es mucho perder un boquerón para pescar un salmón	En ocasionees, para lograr algo importante, se debe estar dispuesto a gastar una cantidad no muy grande.	En desuso
No hay amor feo, si es querido con deseo	Se refiere al afecto que es capaz de ver sólo las cualidades de la persona amada y de obviar lo negativo, hasta la posible fealdad física.	En desuso
No hay caballo, por bueno que sea, que no tropiece	Da a entender que todos podemos cometer errores, por muy experimentados que seamos.	En desuso
No hay carne sin hueso	Todo tiene su parte negativa, su parte triste, por lo que no queda más remedio que aceptarlo como es.	En desuso
No hay cerradura segura si es de oro la ganzúa	Denota lo mucho que puede el dinero.	En desuso
No hay cielo sin nubes, ni paraíso sin serpiente	No hay felicidad completa en este mundo, pues todo tiene su parte alegre y su parte triste.	En desuso
No hay contento sin su descuento	Este refrán indica que no se puede estar del todo contento, porque siempre suele haber algún problema que resolver o porque sobreviene alguna desgracia.	En desuso
No hay cosa más barata que la que se compra	Con frecuencia resultan más costosos los regalos que lo adquirido con dinero, porque se debe corresponder a los obsequios.	En desuso
No hay día sin acedía	Da a entender que todos los días traen consigo algún disgusto o preocupación. No hay día sina algún contratiempo o infortunio.	En desuso
No hay harina sin salvado	No se puede tener todo en esta vida, pues todo tiene sus inconvenientes.	En desuso
No hay hermosura sin ayuda	La vestimenta, el maquillaje y otros elementso contrinuyen a mejorar el aspecto físico.	En desuso
No hay mayor dificultad que la poca voluntad	Para acomenter cualquier empresa es indispensable la voluntad, desearlo.	En desuso
No hay mejor ahorrar que poco gastar	Para ahorrar es indispensable reducir gastos.	En desuso
No hay mejor maestra que el hambre	El aprendizaje necesita estímulos y uno de los mejores estímulos es la necesidad, pues hay personas que, cuando se encuentran en apuros, hacen gala de un ingenio del que carecen en situaciones normales.	En desuso
No hay miel sin hiel	Alude a la poca duración de los bienes humanos, pues, tras un acontecimiento feliz y próspero sigue, por lo general, otro triste y desgraciado.	En desuso
No hay mula sin tacha alguna	En este mundo, todo tiene alguna imperfección, por lo que conviene ser tolerantes y tomar las cosas como son.	En desuso
No hay necesidad de enseñar al gato a arañar	No es necesario aprender lo que se tiene innato o lo que se sabe por naturaleza.	En desuso
No hay nublado que dure un año	Alude a los constantes cambios de las cosas terrenas, en este caso las desgracias, pues no duran siempre.	En desuso
No hay palabra mal dicha si no fuese mal entendida	Recrimina a quien por maldad o mala intención da una interpretación muy distinta a algo que se dijo con buena intención o sin malicia.	En desuso
No hay pan sin afán	Es preciso trabajar para conseguir algo bueno.	En desuso
No hay placer do no hay comer	Alude a la relación que existe entre estar feliz y bien alimentado.	En desuso
No hay plazo que no llegue, ni deuda que no se pague	Reprende la imprudencia del que promete ejecutar algo confiando en el plazo que se le concede, y el engaño de quienes actuando mal se creen impunes.	En desuso
No hay predicador como Fray Ejemplo	Si se quiere convencer a los demás de algo,debemos practicarlo nosotros primeros.	En desuso
No hay primavera sin flores ni verano sin calores	Alude a la obviedad de algunos hechos, del orden lógico que poseen algunas cosas.	En desuso
No hay que extender la pierna más que lo que da de sí la sábana	Recomienda limitarse a los gastos que uno pueda asumir y no excederse. En general, aconsje ano sobrepasara sus posibilidades ni pretensiones.	En desuso
No hay que llorar al muerto sino al vivo	Dado que los muertos ya no sufren y los vivos sí hay que preocuparse por los últimos.	En desuso
No hay vida sin muerte, ni placer sin pesar	Alude a la imposibilidad de alcanzar la dicha completa, porque siempre hay algún perjuicio o algún sinsabor.	En desuso
No mata la carga, sino la sobrecarga	Tanto la resistencia física como la capacidad mental tiene sus límites y, si se cometen excesos, se llega al agotamiento.	En desuso
No se acuerda el cura de cuando fue sacristán	Se recrimina a quien castiga o reprende con severidad los fallos de las personas a su cargo, pese a que él también los cometía no hace mucho, cuando estaba en la misma categoría profesional.	En desuso
No seáis hornera si tenéis la cabeza de cera	Exhorta a no encargarse de una actividad que no puede desarrollar.	En desuso
No se gana el pan sin afán	Para lograr algo, como el sustento, se debe trabajar y esforzarse.	En desuso
No se pescan truchas a bragas enjutas	Lo que es valioso o estimado requiere esfuerzo y diligencia, incluso molestias, del mismo modo que cuando se quiere pescar uno se moja, como sucede con la pesca de la trucha.	En desuso
No se puede chiflar y beber agua	No se puede hacer al mismo tiempo dos cosas incompatibles.	En desuso
No son todos los dedos de la mano iguales	Denota la diferencia que existe entre las personas y los estados.	En desuso
No te rías del mal de vecino, que el tuyo viene de camino	Recomienda prudencia en las burlas que se emiten a los demás, pues pueden recaer sobre uno mismo.	En desuso
No toda palabra requiere respuesta	Recomienda discreción y calma cuando se trata de encajar alguna crítica.	En desuso
No todas las verdades son para dichas	Recuerda que hay ocasiones en las que no conviene decir la verdad.	En desuso
Nuevo rey, nueva ley	Recurda que resulta lógico que hayan cambios cuando se produce un cambio de poder, por lo que recomienda adaptarse a ellos lo antes posible.	En desuso
Obra hecha, venta espera	Alude a que todo esfuerzo merece su recompensa.	En desuso
Ochavo a ochavo, se junta un ducado	Exhorta al ahorro diario como medio para llegar a reunir un caudal importante.	En desuso
Oficio, bueno o malo, da de comer a su amo	Lo más importante de tener un trabajo está en los beneficios que reporta para sustentarse.	En desuso
Oír, ver y callar, recias cosas son de obrar	Aconseja poner mucho cuidado en estas tres cosas, por lo difícil que resulta hacerlo.	En desuso
Ojos verdes, duques y reyes	Lo que resulta raro o poco corriente puede considerarse atractivo, como los ojos verdes, tenidos por señal de distinción de clase.	En desuso
Olivo y aceituno, todo es uno	Se aplica a quien gasta el tiempo buscando diferencias en las cosas carentes de ellas, y también a quien con impertinencia repite algo, pero con distinto nombre o mediante una paráfrasis.	En desuso
Olla que mucho hierve, sabor pierde	Recomienda no demorar en exceso los asuntos. Para mantener tanto tiempo hirviendo una olla hay que tenerla a fuego lento. En sentido metafórico, alude a cualquier trámite o empeño que se prolonga por no seguir el curso regular y, precisamente, por esa causa se pierde.	En desuso
Olla sin sal, haz cuenta que no tienes manjar	Da a entender que lo que carece de lo necesario no aprovecha o que resulta necesaria la presencia de todas las cualidades para llegar a la perfección.	En desuso
Oración de perro no va al cielo	Si se desea pedir algo, conviene ser breve y sincero, sin gastar muchas razones ni emplear malos modos, pues no se consigue lo que se pide mal o de mala gana.	En desuso
Ovejas bobas, por do va una van todas	Denota el poder que puede ejercer el ejemplo y las malas compañías.	En desuso
Paciencia y barajar	Si se quiere conseguir algo hay que saber ser paciente y perseverante al mismo tiempo, tanto en el juego como en la vida.	En desuso
Padre comerciante, hijo caballero, nieto pordiosero	Los bienes adquiridos con tesón por una generación no siempren se mantienen en las generaciones siguientes. En un sentido más general, se puede emplear para significar que, con frecuencia la generación siguiente adopta una actitud contraria.	En desuso
Pajarilla que en erial se cría, siempre por él pía	Se refiere al amor que se siente por la tierra en que se nace.	En desuso
Palabras sin obras se venden barato	Conviene dar pruebas de la palabra dada.	En desuso
Palabras y plumas, el viento las lleva	Con frecuencia no se cree la promesa dada porque se incumple con facilidad, por lo que se recomienda dejar constancia plasmándola por escrito. Se puede aplicar también a quien ofrece con facilidad lo que poco cuesta.	En desuso
Palabra y piedra suelta no tienen vuelta	Recomienda ser prudentes cuando se trata de emitir juicios que pueden afectar a terceros.	En desuso
Pan ajeno caro cuesta	Recuerda el alto precio que paga quien depende de los demás en cuestiones de primera necesidad. En efecto, el favor ajeno obliga a corresponder, a veces hasta mucho más del beneficio recibido.	En desuso
Para el amor no hay edad	Recuerda que el amor puede llegar en cualquier momento.	En desuso
Para el mal oficial no hay herramienta buena	Este refrán critica a quienes alegan pretextos sin fundamento para evitar hacer algo. Critica también a quienes tratan de justificar sus errores o faltas, tomando como excusa hechos o circunstancias que le son totalmente ajenos.	En desuso
Para enfermedad de años no hay medicina	Recuerda que la vejez lleva emparejada una serie de dolencias ineludibles.	En desuso
Para los desgraciados todos los días son martes	Se aplica a la persona que continuamente está sufriendo adversidades.	En desuso
Para que el ciego cante, la propina por delante	Si deseamos predisponer a una persona a nuestro favor habrá que tener alguna atención con ella.	En desuso
Para todo hay remedio, sino para la muerte	Se emplea a modo de consuelo para quien ha sufido alguna desgracia o contratiempo.	En desuso
