Refran	Significado	Uso
Soñaba el ciego que veía, y soñaba lo que quería	Nuestros sueños son reveladores de nuestras ansias y deseos.	En desuso
Soplar y sorber, no puede ser	Expresa que no es posible hacer al mismo tiempo dos cosas que son contrarias entre sí.	En desuso
Suegra y nuera, perro y gato, no comen en el mismo plato	Alude a las animadversión habitual entre ciertos animales y parientes.	En desuso
Sufro y callo, por el tiempo en que me hallo	Palabras que profiere quien ha de callar y aguantar discretamente por encontrarse en situación desfavorable.	En desuso
Tal amo, tal criado	Según es el dueño de una casa, así son los que se encuentran a su servicio. En un sentido más amplio, se aplica a la influencia del jefe en sus subordinados.	En desuso
Tal para cual, dijo el pardal	Se aplica a personas de poca valía y que por alguna razón se relacionan. Se establece semejanza o incluso igualdad aplicado a personas que valen poco. Por lo general, se emplea en sentido negativo.	En desuso
Tan presto se va el cordero como el carnero	La muerte puede aparecer en cualquier momento, tanto en la mocedad como en la vejez.	En desuso
Tanto escarba la cabra, que descubre el cuchillo con que la matan	La excesiva curiosidad y la poca cautela puede provocar un gran perjuicio.	En desuso
Tanto peca el que roba la huerta como el queda a la puerta	Penaliza al cómplice y no sólo al ejecutor de una fechoría.	En desuso
Tanto quiso el diablo a su hijo que le sacó un ojo	Recrimina a quien maleducan a sus hijos dándoles todo lo que piden, sea o no beneficioso para ellos. En sentido general, alude al daño oral o material que causa un amor excesivo e imprudente.	En desuso
Ten siempre una vela encendida por si otra se apaga	Ensalza la precaución de disponer de varias soluciones por si falla una.	En desuso
Todo llega, todo cansa, todo se acaba	El paso del tiempo es inexorable y no podemos hacer nada para evitarlo.	En desuso
Todo lo nuevo agrada	Alude a la buena acogida que, por lo general, tienen las cosas nuevas.	En desuso
Todos somos hijos de Eva, sino que nos diferencia la seda	Pese a tener todos un mismo origen, las clases sociales se distiguen por la educación y las riquezas. Por otra parte, el refrán puede tener el sentido de que nadie debe sentirse superior a los demás porque la única diferencia es muy superficial, la vestimenta. Advierte que no nos fiemos de las apariencias porque las reacciones humanas no se dominan fácilmente y personas ilustres y distinguidas pueden cometer iniquidades como cualquiera	En desuso
Todo tiene haz y envés	Afirma que todas las cosas están formadas por su parte positiva y su parte negativa.	En desuso
Treinta monjes y un abad no pueden hacer beber a un asno contra su voluntad	Advierte contra la terquedad de algunas personas.	En desuso
Tripa llena, ni bien huye ni bien pelea	Expresa que el estómago lleno produce una considerable reducción en los movimientos, pues disminuye las ganas de trabajar o de andar.	En desuso
Tripa vacía, corazón sin alegría	Alude a la relación existente entre alegría y buena alimentación, pues, quien no ha saciado su apetito, no tiene ganas ni de divertirse.	En desuso
Triste está la casa donde la gallina canta y el gallo calla	Este refrán da a entender que el marido debe ser el amo en su casa, pues no está bien gobernada la casa en la que manda la mujer.	En desuso
Tu secreto, ni al más discreto	Previene desconfiar de todo el mundo sin excepciones y no divulgar lo que no es prudente.	En desuso
Una aguja en un pajar, es difícil de encontrar	Alude a la dificultad de encontrar algo. Se emplea cuando se emprende una tarea de éxito dudoso por el tiempo que requiere.	En desuso
Una cosa es enhebrar y otra dar puntadas	No es lo mismo iniciar una tarea que acometerla hasta el final.	En desuso
Un agravio consentido, otro venido	No hay que dejarse humillar una sola vez para evitar nuevas humillaciones.	En desuso
Una mano lava a la otra, y ambas la cara	Alude a la necesidad de ayudarse unos a otros para conseguir las cosas, al tiempo que recuerda la obligación de corresponder a las ayudas que nos prestan. Se refiere también al alivio o a la ventaja de que alguien nos ayude para acabar antes y con menos esfuerzo.	En desuso
Una manzana cada día, de médico te ahorraría	Hace una recomendación alimenticia para mantener un buen estado de salud. La manzana es considerada una fruta saludable y, por su precio razonable, está muy aceptado su consumo	En desuso
Una oveja mala, el rebaño entero daña	Alude a la influencia negativa que ejercen las malas compañías.	En desuso
Una pared blanca sirve al loco de carta	Se emplea cuando manchan una pared escribiendo tonterías o palabras inconvenientes.	En desuso
Un asno rasca a otro	Se refiere a que resulta muy beneficioso encontrarse entre personas similares, porque suelen ayudarse entre sí.	En desuso
Una vez engañan al cuerdo, y dos al necio	Se dice como reproche a quien no aprende con la experiencia, y también al rehusar alguna propuesta que encierra engaño.	En desuso
Una vez te casarás y mil te arrepentirás	Previene contra el desengaño que resulta ser a veces el matrimonio. También alude a la libertad que pierde quien lo contrae.	En desuso
'Un día es un día', pensó el avaro. Y añadió a la olla un garbanzo	De forma irónica se alude a la avaricia.	En desuso
Un médico cura, dos dudan, tres muerte segura	Contiene un ataque directo contra los médicos. Se recomienda no ir mucho al médico.	En desuso
Uno levanta la caza, y otro la mata	Hay personas que consiguen el fruto del trabajo realizado por otros.	En desuso
Uno piensa el bayo y otro el que lo ensilla	Señala la distinta forma de pensar que tienen los que mandan y los que obedecen.	En desuso
Unos crían gallinas y otros se comen los pollos	Se aplica a quien se aprovecha del esfuerzo ajeno.	En desuso
Unos lo siembran, y otros lo siegan	Alude a las personas que se benefician fácil o gratuitamente del esfuerzo ajeno.	En desuso
Unos sirven para vendimiar, y otros para sacar cestos	Ningún trabajo debe minusvalorarse. Cada cual hace aquello para lo queestá capacitado. Todas las tareas son necesarias y contribuyen a la resolución satisfactoria de una empresa.	En desuso
Uno y ninguno, todo es uno	Además del sentido recto, se emplea para dar a entender que alguna cosa es totalmente diversa, impertinente y fuera de propósito para el caso.	En desuso
Un padre para cien hijos y no cien hijos para un padre	El amor auténtico que sienten los padres por los hijos suele verse correspondido a veces por la ingratitud de los hijos.	En desuso
Un pleito trae consigo (otros) ciento	Recomienda evitar en la medida de lo posible iniciar un pleito porque puede acarrear muchos más.	En desuso
Un tiempo tras otro viene	Aconseja no desfallecer ante la adversidad ni perder la esperanza de que la suerte cambie.	En desuso
Un tropezón cualquiera da en la vida	Se emplea para disculpar una equivocación, por el hecho de ser solamente una. Nadie está libre de cometer algún error o falta, porque todos somos falibles e imperfectos.	En desuso
Uso hace maestro	Con la práctica se adquiere habilidad y experiencia.	En desuso
Vanse los amores y quedan los dolores	En la medida de lo posible, conviene ser prudente con el amor, pues las pasiones vehementes pueden pasar pronto, pero las consecuencias pueden duran bastante e, incluso, ser duraderas.	En desuso
Vase el bien al bien, y las abejas a la miel	Se aplica a quien es feliz y tiene una situación económica muy desahogada, a quien tiene medios y puede enriquecerse aún más, y también a quien tiene riqueza y le favorece la suerte.	En desuso
Vida sin amigos, muerte sin testigos	Quien carece de amigos, se verá solo en los momentos difíciles.	En desuso
Viejo es Pedro para cabrero	Se aplica con cierta ironía a quien ya no tiene edad para hacer cosas de jóvenes.	En desuso
Viento y ventura, poco dura	Equipara el viento con los cambios de fortuna, por su inestabilidad.	En desuso
Vinagre y miel saben mal y hacen bien	Algunos remedios no son del agrado del enfermo, pero ayudan a sanarlo.	En desuso
Vino por el color, el pan por el olor y todo por el sabor	Explica la cualidad que ayuda a conocer el pan y el vino y otros aspectos que entran en juego, como el sabor. La clave está en saborear los alimentos con varios sentidos.	En desuso
Vistan un palo, y parecerá algo	Da a entender que, en ocasiones, el uso de adornos y una ropa adecuada contribuye a mejorar notablemente el aspecto físico. Dado que, con frecuencia se trata a las pesonas según se las ve, resulta importante una buena presentación.	En desuso
Ya que no seas casto, sé cauto	Recomienda tratar de ser discreto o evitar el escándalo a quien posee algún defecto o no domina su lujuria.	En desuso
Yegua cansada, prado halla	Se puede encontrar alivio incluso en momentos de necesidad o dificultad.	En desuso
Con el amor no se juega	No se debe jugar con los sentimientos de alguien.
Con la medida con que midáis, seréis medidos	Recomienda tratar a los demás como nos gustaría que hicieran con nosotros.
Lo bueno poco dura	Alude a la escasa duración de las cosas que nos causan alegría o placer. Señala que, por lo general, abunda más lo malo que lo bueno.
Lo que no se llevan los ladrones, aparece por los rincones	Se dice cuando finalmente se encuentra algo que se ha buscado durante mcho tiempo sin éxito.
Porfía mata la caza	Es necesaria la perseverancia para alcanzar las cosas difíciles.
Por San Matías se iguala la noche al día
Por un clavo se pierde una herradura	Hay que poner remedio cuando el desperfecto es pequeño, para evitar que llegue a más y resulte mucho más costoso.
Por un garbanzo no se descompone la olla	Da a entender que la actitud o la opinión de alguien no es suficiente para cambiar lo decidido por la mayoría.
Por un punto ruin, perdió su asno Martín	Se refiere a la pérdida de algo importante por un hecho insignificante.
Principio quieren las cosas	Anima a decidirse a empezar algo arduo de hacer o algo cuyo término no se ve.
Promete poco y cúmplelo pronto	Aconseja no ser muy pródigo en promesas por temor a no cumplirlas todas y cumplirlas lo ante posible.
Prometer y no cumplir, mil veces lo vi	Recuerda la facilidad con que se incumplen las promesas.
Pronto y bien, rara vez juntos se ven	Recomienda tomarse el tiempo suficiente para hacer las cosas bien.
Puerco fiado gruñe todo el año	Explica los inconvenientes que provocan las deudas, por la continua molestia de los acreedores.
Puerta abierta, al santo tienta	Cuando hay muchas facilidades para caer en la tentación, resulta muy difícil resistirse.
Pues ara el rocín, ensillemos al buey	Del mismo modo que no es propio del caballo arar sino llevar silla ni del buey ensillarlo sino arar, aconseja no trastocar las ocupaciones sino que cada uno haga lo que sabe, pues no se puede esperar nada bueno si las cosas van al revés.
Pues tenemos hogazas, no busquemos tortas	Conviene conformarse con lo que se tiene, si no se puede conseguir algo mejor.
Que no vea tu mano derecha lo que hace tu mano izquierda	Recomienda la reserva en todos los asuntos.
Quien adelante no mira, atrás se queda	Anima a tratar de luchar en todo momento para conseguir tener éxito.
Quien anda por la mar, aprende a rezar	Se refiere a los peligros del mar.
Quien antes nace, antes pace	En sentido recto alude a los hijos primogénitos, que se llevan lo más importante de la hacienda, en particular en los mayorazgos. En un sentido más amplio, se refiere a quien se anticipa a los demás halla más fácilmente lo que quiere.
Quien come y condesa dos veces pone la mesa	Si se come lo suficiente, queda para otras veces, lo cual representa salud y economía. Este refrán recomienda moderación en los gastos de comida y, en sentido general, aconseja no desperdiciar la hacienda, ahorrar para mantenerse sin necesidad de pedir ayuda a los demás.
Quien con la ropa de otro se viste en la calle le desnudan	El que toma lo de otro fácilmente será desposeído.
Quien con lobos anda, a aullar se enseña	Alude a la poderosa influencia de las malas compañías, por lo que conviene huir de ellas.
A buen entendedor, pocas palabras bastan	Una persona despierta e inteligente entiende rápidamente lo que le dicen sin necesidad de entrar en detalles, basta una mera insinuación para comprender y actuar en consecuencia. Por lo general, se emplea la primera parte del refrán para dar una advertencia sin utilizar palabras ofensivas o para aludir a algo que no se desea mencionar de modo expreso.	Muy usado
A caballo regalado, no le mires el diente	Este refrán recomienda aceptar los regalos de buen grado y sin poner reparo alguno, pues se considera descortés el analizar exhaustivamente la calidad del obsequio, así como resaltar sus defectos o fallos.	Muy usado
A cada cerdo le llega su San Martín	Este refrán indica que no queda impune el comportamiento del malvado, pues, antes o después, quien ha obrado mal recibe su merecido.	Muy usado
A la tercera va la vencida	Se emplea esta frase cuando no se consigue al primer intento el fin que pretendemos, sino tras repetirlos con mayor ahinco. Se dice tanto después del segundo intento como del tercero: en el primer caso, para expresar el deseo de que se haga realidad aquello que se está intentando; en el segundo caso, para constatar que se ha conseguido el fin deseado al tercer intento. Puede significar también que es prudente desistir de hacerlo después de tres tentativas infructuosas.	Muy usado
Al pan, pan, y al vino, vino	Se dice cuando se habla o se debe hablar con sinceridad, diciendo lo que sea llanamente y sin rodeos.	Muy usado
A mal tiempo, buena cara	Se puede emplear en sentido literal (el tiempo atmosférico) y metafórico. Referido al físico humano, aconseja no hacer notar los gestos que pueden reflejar nuestra decepción ante cualquier suceso. Referido al comportamiento, recomienda mantener el temple y no desanimarse cuando se presentan contrariedades y momentos difíciles, pues, pese a no poder cambiar la situación, se puede cambiar la actitud.	Muy usado
A nadie le amarga un dulce	No se rechaza algo agradable o beneficioso, por poco que sea.	Muy usado
Año nuevo, vida nueva	Se cree que el simple cambio de año conlleva mejores expectativas. Se dice también al comenzar el año para manifestar el propósito -no siempre mantenido- de cambiar de costumbres o de otras cosas, tras hacer balance del anterior. Asimismo se dice como fórmula de saludo para manifiesta el deseo de que el cambio de año traiga mejores expectativas.	Muy usado
A río revuelto, ganancia de pescadores	Del mismo modo que aparece más pesca cuando las aguas de un río se revuelven, en las situaciones confusas o cuando se producen cambios o desavenencias, hay quienes sacan beneficio aprovechando tales circunstancias.	Muy usado
Bicho malo nunca muere	Se aplica a personas y animales dotados de mala condición, para señalar que el mal persiste, que nunca desaparece. También se suele decir de la persona enferma, con el objeto de animarla.	Muy usado
Del dicho al hecho hay gran trecho	En ocasiones, existe mucha distancia entre lo que uno dice y lo que hace, por lo que conviene no confiar en promesas que pueden no cumplirse.	Muy usado
De noche, todos los gatos son pardos	Con la oscuridad de la noche o la falta la luz, resulta fácil disimular las tachas de lo que se vende, no se perciben los defectos de quien se presenta.	Muy usado
Desgraciado en el juego, afortunado en amores	Suele decirse a modo de consuelo a quien pierde en el juego. Puede emplearse también con un sentido irónico.	Muy usado
De tal palo, tal astilla	Por lo general, el carácter y las costumbres se transmiten de padres a hijos. Se puede aplicar también a todo lo que se parece a su origen.	Muy usado
Dime con quién andas, y te diré quién eres	Se puede deducir los gustos y aficiones de alguien por los amigos y ambientes que frecuenta. Del mismo modo, este refrán advierte de la gran influencia que ejerce en el comportamiento o en las costumbres de alguien las compañías de los demás, ya sean buenas o malas.	Muy usado
Dime de qué presumes y te diré de qué careces	Suele suceder que quien alardea de algo precisamente carece de ello.	Muy usado
Dios los cría, y ellos se juntan	Alude con cierta ironía a la inclinación natural que lleva a juntarse a los de un mismo genio y temperamento. Se aplica más bien a personas de conducta censurable.	Muy usado
Donde dije digo, digo Diego	Se emplea para rectificar una afirmación o desdecirse.	Muy usado
Donde hay confianza, da asco	Censura de quien, por abuso de confianza, se comporta inadecuadamente.	Muy usado
Donde las dan, las toman	Quien hace daño a alguien o habla mal de él, suele recibir el mismo pago. Se emplea para advertir a quien ha hecho alguna faena que seguramente recibirá la réplica correspondiente.	Muy usado
El amor es ciego	No se ven defectos en la persona amada o en lo que se ama.	Muy usado
El muerto, al hoyo, y el vivo, al bollo	Cuando alguien muere, los allegados al fallecido, por mucho pesar que sientan, han de atender sus asuntos y necesidades, entre ellas una tan básica como su manutención. Se aplica también este refrán para recriminar a quien se olvida demasiado pronto del muerto.	Muy usado
El mundo es un pañuelo	Se dice esta paremia cuando se encuentra a alguien de improviso en un lugar inesperado o después de mucho tiempo, incluso años.	Muy usado
El que la hace, la paga	Justifica la penalización o la indemnización por algún descuido o torpeza.	Muy usado
El que la sigue, la consigue	Quien pone los medios necesarios y no desiste en su empeño, alcanza el fin que persigue.	Muy usado
El que parte y reparte se queda con la mejor parte	Quien tiene algo a su alcance suele quedarse con algo, o con lo mejor para sí mismo.	Muy usado
En boca cerrada, no entran moscas	Muestra la utilidad de estar callado, pues el silencio excusa muchas necedades.	Muy usado
En martes, ni te cases ni te embarques	Se recomienda no hacer nada arriesgado el martes, por considerarse un día aciago, de mala suerte.	Muy usado
En todas partes cuecen habas	Hay problemas o disgustos en todas partes y circunstancias.	Muy usado
Es peor el remedio que la enfermedad	Manifiesta que algunas ayudas o soluciones producen más inconvenientes que el problema en sí.	Muy usado
Genio y figura, hasta la sepultura	Con los años no se cambia el carácter, lo que se ha recibido por herencia genética.	Muy usado
Hombre prevenido, vale por dos	Alude a la ventaja de obrar con prevención. Aconseja ser cauto, estar vigilante para no ser engañado y considerar así que ya se ha superado la mitad de la dificulltad.	Muy usado
Hoy por ti, mañana por mí	Está bien ayudarse y complacerse unos a otros, sin olvidar que es natural la correspondencia.	Muy usado
Ir por lana y volver trasquilado	Alude a quien fue a ofender y volvió ofendido, a quien busca más de lo que tiene y se queda sin lo que poseía. Se aplica también a quien ha sufrido una pérdida o un perjuicio en lo que creía ganar o encontrar beneficio.	Muy usado
La excepción confirma la regla	Con ella se confirma o se alaba lo que se sale de lo habitual.	Muy usado
La letra con sangre entra	Denota que es necesario el trabajo y el estudio para aprender algo o para avanzar en algo. A veces, se asocia únicamente al castigo corporal como estímulo para aprender.	Muy usado
La ocasión hace al ladrón	Con frecuencia se cometen malas acciones que no se habían pensado, pero se hacen por presentarse la oportunidad de llevarlas a cabo.	Muy usado
Las apariencias engañan	El exterior de personas y cosas contribuye a hacerse una opiniónpor lo general equivocada, por lo que no se debe juzgar a las personas sólo por su apariencia.	Muy usado
La suerte está echada	Se emplea esta paremia a modo de consuelo cuando resulta imposible modificar una situación, en especial su desenlace.	Muy usado
La unión hace la fuerza	Contando con la colaboración y solidaridad de muchas personas, ya sean fuertes o en apariencia débiles, se pueden alcanzar el éxito, vencer a cualquier rival  o salir airoso de una situación difícil.	Muy usado
La venganza es un plato que se sirve frío	Cuando alguien desea tomar la revancha contra alguien, suele esperar a estar tranquilo para reflexionar mejor cómo va a hacerlo para que cause más daño.	Muy usado
Mañana será otro día	Recomienda dejar para más adelante la búsqueda de la solución a un problema o a una situación difiícil.	Muy usado
Más vale maña que fuerza	En muchas ocasiones, la habilidad suple la violencia y el rigor.	Muy usado
Más vale prevenir que curar	Es mejor adoptar los medios necesarios para que una situación no desemboque en un final sin solución alguna.	Muy usado
Más vale tarde que nunca	En ocasiones, no importa llegar con retraso a algo, si es útil.	Muy usado
Más ven cuatro ojos que dos	Además de emplearse en su sentido recto, se dice para señalar que es más conveniente adoptar resoluciones consultadas a varias personas que basadas en una sola opinión.	Muy usado
Mucho ruido y pocas nueces	En ocasiones, se concede mucha importancia a algo que no la tiene. También se dice cuando se hace mucha propaganda para algo insignificante.	Muy usado
Nadie es perfecto	Se dice esta paremia para discupar alguna torpeza.	Muy usado
Nadie es profeta en su tierra	Se aplica a quien obtiene buena reputación fuera de su lugar de origen, cuando en éste no pudo disponer de los medios adecuados para alcanzarla, en ocasiones por envidia o enemistad. También se emplea para aludir a quienes se han visto obligados a abandonar su tierra natal precisamente para conseguir en otro lugar lo que se la negado en el suyo: la posibilidad de desarrollar sus aptitudes.	Muy usado
No dejes para mañana lo que puedas hacer hoy	Aconseja no mostrase perezosos sino todo lo contrario, ser diligentes en hacer el trabajo pendiente.	Muy usado
No es oro todo lo que reluce	Recomienda desconfiar de las apariencias, pues no todo lo que parece bueno lo es realmente.	Muy usado
No hay mal que por bien no venga	Este refrán transmite una visión optimista de la realidad, pues indica que de una contrariedad se puede extraer algo bueno, que una contrariedad puede tener resultados favorables.	Muy usado
No hay que empezar la casa por el tejado	Se emplea esta frase proverbial para indicar que no se debe alterar el orden lógico, pues con ello nada se consigue.	Muy usado
No hay que vender la piel del oso antes de haberlo cazado	Advierte contra la precipitación y el optimismo excesivo, pues se debe tener total seguridad en conseguir algo antes de darlo por hecho.	Muy usado
No por mucho madrugar amanece más temprano	No basta la diligencia ni conviene precipitarse en nuestro trabajo para apresurar el logro de algo, porque los acontecimientos deben seguir su curso natural.	Muy usado
No se hizo la miel para la boca del asno	Recrimina a quienes eligen dejan lo mejor de lo que se les presenta para quedarse con lo peor, por no saber apreciar su valor.	Muy usado
Nunca llueve a gusto de todos	Lo que resulta placentero para unos puede desagradar a otros.	Muy usado
Obras son amores, que no buenas razones	En cuestiones de amores, conviene dar pruebas a la persona amada del afecto que se siente. En sentido general, se refiere a los que hablan mucho pero luego nada hacen o no cumplen lo prometido.	Muy usado
Ojos que no ven, corazón que no siente	La ausencia contribuye a olvidar lo que se ama o a sentir menos las desgracias lejanas.	Muy usado
Por un oído me entra y por otro me sale	Se dice para dar a entender que alguien no hace caso ni aprecio de lo que le dicen o aconsejan.	Muy usado
Quien fue a Sevilla perdió su silla	En un sentido recto, se emplea cuando alguien se ausenta por unos momentos de la habitación y, al regresar, otra persona ha ocupado su sitio; si la recupera por irse durante unos momentos la persona que se la quitado, dirá: y quien se fue a Aragón la encontró. En un sentido más amplio, da a entender que la ausencia puede ocasionar una novedad perjudicial, como la pérdida de un empleo, por lo que se aconseja no abandonar el puesto cuando hay personas que lo desean.	Muy usado
Quien no tiene padrino, no se bautiza	Expresa lo que puede suceder si no se tiene algún protector.	Muy usado
Quien ríe el último ríe mejor	Recomienda no cantar victoria antes de tiempo. También se emplea para aludir a la alegría que se siente al finalizar algo con éxito. Puede tener un sentido irónico, al decirlo quien ha sido el primero en alcanzar alg que pretendía al mismo tiempo un rival.	Muy usado
Tras la tempestad, viene la calma	Este refrán anima a ser optimistas cuando las circunstancias son adversas, al afirmar que pueden cambiar rápidamente y pasar a una situación favorable en poco tiempo. Se utiliza también en su sentido literal, para aludir al tiempo atmosférico.	Muy usado
Vísteme despacio, que tengo prisa	Aconseja no apresurarse cuando uno tiene mucha prisa por hacer algo.	Muy usado
Zapatero, a tus zapatos	Cada uno debe ocuparse de sus asuntos, de su profesión y opinar sólo de lo que entiende, evitando meterse en lo que no le afecta ni entiende.	Muy usado
A barriga llena, corazón contento	Una vez saciado el apetito, uno se siente satisfecho y feliz.	Poco usado
A boda ni bautizo, no vayas sin ser llamado	Se recrimina a los entrometidos, especialmente cuando hay alegría y abundancia, como sucede en los banquetes. Alude también a la cordura con la que debe vivir quien se precia de ser honrado.	Poco usado
A buen hambre no hay pan duro	Cuando uno está hambriento, ha de comer lo que encuentra y no poner reparos a la calidad de lo que tiene a su alcance o de lo que se le ofrece. En un sentido más amplio, cuando se tiene necesidad, no se pone reparo alguno.	Poco usado
